Match,Innings,Date,M/Inns,Versus,Ground,How Dismissed,Runs,B/F,S/R,,Aggr,Avg,S/R
1,1,19/01/2013,1st,New Zealand,Boland Park,c N L McCullum b J E C Franklin,18,34,52.94,,18,18,52.94
2,2,22/01/2013,2nd,New Zealand,Diamond Oval,b K D Mills,25,28,89.29,,43,21.5,69.35
3,3,25/01/2013,2nd,New Zealand,Senwes Park,b J E C Franklin,31,38,81.58,,74,24.67,74
4,4,24/03/2013,2nd,Pakistan,Willowmoore Park,b Junaid Khan,3,12,25,,77,19.25,68.75
5,5,26/07/2013,1st,Sri Lanka,Pallekele International Cricket Stadium,c †K C Sangakkara b N L T C Perera,20,28,71.43,,97,19.4,69.29
6,6,28/07/2013,1st,Sri Lanka,Pallekele International Cricket Stadium,b S L Malinga,8,9,88.89,,105,17.5,70.47
7,7,31/07/2013,2nd,Sri Lanka,R Premadasa Stadium,b S M S M Senanayake,27,21,128.57,,132,18.86,77.65
8,8,06/11/2013,1st,Pakistan,Sheikh Zayed Stadium,st Umar Akmal b Shahid Afridi,40,57,70.18,,172,21.5,75.77
9,9,08/11/2013,1st,Pakistan,Sheikh Zayed Stadium,c Misbah-ul-Haq b Junaid Khan,112,135,82.96,,284,31.56,78.45
10,10,11/11/2013,1st,Pakistan,Sharjah Cricket Stadium,lbw b Saeed Ajmal,34,41,82.93,,318,31.8,78.91
11,11,24/11/2013,2nd,Pakistan,Newlands,b Bilawal Bhatti,19,24,79.17,,337,30.64,78.92
12,12,27/11/2013,2nd,Pakistan,St George's Park,c Misbah-ul-Haq b Shahid Afridi,47,52,90.38,,384,32,80.17
13,13,30/11/2013,2nd,Pakistan,SuperSport Park,c Saeed Ajmal b Bilawal Bhatti,15,18,83.33,,399,30.69,80.28
14,14,05/12/2013,1st,India,Wanderers Stadium,c & b V Kohli,135,121,111.57,,534,38.14,86.41
15,15,08/12/2013,1st,India,Kingsmead,c R G Sharma b R Ashwin,106,118,89.83,,640,42.67,86.96
16,16,11/12/2013,1st,India,SuperSport Park,b I Sharma,101,120,84.17,,741,46.31,86.57
17,17,06/07/2014,1st,Sri Lanka,R Premadasa Stadium,b A D Mathews,27,35,77.14,,768,45.18,86.2
18,18,09/07/2014,2nd,Sri Lanka,Pallekele International Cricket Stadium,b S L Malinga,4,6,66.67,,772,42.89,86.06
19,19,12/07/2014,1st,Sri Lanka,Mahinda Rajapaksha International Cricket Stadium,c B A W Mendis b S M S M Senanayake,128,127,100.79,,900,47.37,87.89
20,20,17/08/2014,1st,Zimbabwe,Queens Sports Club,c B R M Taylor b J Nyumbu,63,68,92.65,,963,48.15,88.19
21,21,19/08/2014,1st,Zimbabwe,Queens Sports Club,c E Chigumbura b J Nyumbu,38,38,100,,1001,47.67,88.58
22,22,21/08/2014,2nd,Zimbabwe,Queens Sports Club,c S C Williams b T Panyangara,84,75,112,,1085,49.32,90.04
23,23,27/08/2014,2nd,Australia,Harare Sports Club,c J P Faulkner b M A Starc,19,18,105.56,,1104,48,90.27
24,24,29/08/2014,1st,Zimbabwe,Harare Sports Club,c T L Chatara b P Utseya,76,76,100,,1180,49.17,90.84
25,25,02/09/2014,2nd,Australia,Harare Sports Club,c S P D Smith b G J Maxwell,1,5,20,,1181,47.24,90.57
26,26,04/09/2014,1st,Zimbabwe,Harare Sports Club,c †B R M Taylor b T L Chatara,2,4,50,,1183,45.5,90.44
27,27,06/09/2014,2nd,Australia,Harare Sports Club,c G J Bailey b G J Maxwell,7,7,100,,1190,44.07,90.49
28,28,21/10/2014,2nd,New Zealand,Bay Oval,c T W M Latham b T A Boult,9,5,180,,1199,42.82,90.83
29,29,24/10/2014,1st,New Zealand,Bay Oval,b M J McClenaghan,26,33,78.79,,1225,42.24,90.54
30,30,27/10/2014,1st,New Zealand,Seddon Park,not out,80*,94,85.11,,1305,45,90.19
31,31,14/11/2014,2nd,Australia,WACA Ground,c †M S Wade b M G Johnson,2,7,28.57,,1307,43.57,89.89
32,32,16/11/2014,2nd,Australia,WACA Ground,c S R Watson b J R Hazlewood,4,8,50,,1311,42.29,89.67
33,33,19/11/2014,2nd,Australia,Manuka Oval,c M R Marsh b J R Hazlewood,47,53,88.68,,1358,42.44,89.64
34,34,21/11/2014,1st,Australia,Melbourne Cricket Ground,c & b G J Maxwell,17,38,44.74,,1375,41.67,88.54
35,35,23/11/2014,1st,Australia,Sydney Cricket Ground,c †M S Wade b P J Cummins,107,123,86.99,,1482,43.59,88.42
36,36,28/01/2015,1st,West Indies,SuperSport Park,c J L Carter b J O Holder,4,7,57.14,,1486,42.46,88.29
37,37,15/02/2015,1st,Zimbabwe,Seddon Park,c C R Ervine b T L Chatara,7,16,43.75,,1493,41.47,87.88
38,38,22/02/2015,2nd,India,Melbourne Cricket Ground,c V Kohli b Mohammed Shami,7,15,46.67,,1500,40.54,87.51
39,39,27/02/2015,1st,West Indies,Sydney Cricket Ground,c A D Russell b J O Holder,12,19,63.16,,1512,39.79,87.25
40,40,03/03/2015,1st,Ireland,Manuka Oval,c †G C Wilson b J F Mooney,1,4,25,,1513,38.79,87.1
41,41,07/03/2015,2nd,Pakistan,Eden Park,c †Sarfaraz Ahmed b Mohammad Irfan,0,2,0,,1513,37.83,87
42,42,11/03/2015,1st,United Arab Emirates,Sky Stadium,c †Saqlain Haider b Amjad Javed,26,45,57.78,,1539,37.54,86.27
43,43,18/03/2015,2nd,Sri Lanka,Sydney Cricket Ground,not out,78*,57,136.84,,1617,39.44,87.83
44,44,24/03/2015,1st,New Zealand,Eden Park,c T G Southee b T A Boult,14,17,82.35,,1631,38.83,87.78
45,45,10/07/2015,2nd,Bangladesh,Shere Bangla National Stadium,c Sabbir Rahman b Nasir Hossain,35,41,85.37,,1666,38.74,87.73
46,46,12/07/2015,1st,Bangladesh,Shere Bangla National Stadium,c Sabbir Rahman b Mustafizur Rahman,2,9,22.22,,1668,37.91,87.42
47,47,15/07/2015,1st,Bangladesh,Zahur Ahmed Chowdhury Stadium,b Mustafizur Rahman,7,8,87.5,,1675,37.22,87.42
48,48,11/10/2015,1st,India,Green Park,c S K Raina b R Ashwin,29,33,87.88,,1704,37.04,87.43
49,49,14/10/2015,2nd,India,Holkar Cricket Stadium,c M M Sharma b Harbhajan Singh,34,36,94.44,,1738,36.98,87.56
50,50,18/10/2015,1st,India,Saurashtra Cricket Association Stadium,run out,103,118,87.29,,1841,38.35,87.54
51,51,22/10/2015,2nd,India,MA Chidambaram Stadium,c A M Rahane b Harbhajan Singh,43,35,122.86,,1884,38.45,88.12
52,52,25/10/2015,1st,India,Wankhede Stadium,c V Kohli b S K Raina,109,87,125.29,,1993,39.86,89.57
53,53,03/02/2016,2nd,England,Mangaung Oval,not out,138*,96,143.75,,2131,42.62,91.81
54,54,06/02/2016,1st,England,St George's Park,lbw b B A Stokes,22,33,66.67,,2153,42.22,91.46
55,55,09/02/2016,2nd,England,SuperSport Park,c J E Root b A U Rashid,135,117,115.38,,2288,44,92.59
56,56,12/02/2016,2nd,England,Wanderers Stadium,b B A Stokes,27,42,64.29,,2315,43.68,92.12
57,57,14/02/2016,2nd,England,Newlands,c †J C Buttler b R J W Topley,4,17,23.53,,2319,42.94,91.66
58,58,03/06/2016,1st,West Indies,Providence Stadium,b C R Brathwaite,30,34,88.24,,2349,42.71,91.61
59,59,07/06/2016,1st,Australia,Providence Stadium,lbw b J R Hazlewood,18,23,78.26,,2367,42.27,91.5
60,60,11/06/2016,2nd,Australia,Warner Park,c J P Faulkner b J R Hazlewood,19,29,65.52,,2386,41.86,91.21
61,61,15/06/2016,1st,West Indies,Warner Park,b J E Taylor,71,103,68.93,,2457,42.36,90.36
62,62,19/06/2016,1st,Australia,Kensington Oval,not out,5*,5,100,,2462,42.45,90.38
63,63,24/06/2016,2nd,West Indies,Kensington Oval,c †D Ramdin b S T Gabriel,6,6,100,,2468,41.83,90.4
64,64,25/09/2016,1st,Ireland,Willowmoore Park,b K J O'Brien,82,66,124.24,,2550,42.5,91.2
65,65,30/09/2016,2nd,Australia,SuperSport Park,c T M Head b S M Boland,178,113,157.52,,2728,44.72,93.78
66,66,02/10/2016,1st,Australia,Wanderers Stadium,c C P Tremain b J W Hastings,22,24,91.67,,2750,44.35,93.76
67,67,05/10/2016,2nd,Australia,Kingsmead,c D J Worrall b C P Tremain,70,49,142.86,,2820,44.76,94.57
68,68,08/10/2016,2nd,Australia,St George's Park,c A Zampa b C P Tremain,18,14,128.57,,2838,44.34,94.73
69,69,12/10/2016,1st,Australia,Newlands,c M R Marsh b S M Boland,12,18,66.67,,2850,43.85,94.56
70,70,28/01/2017,2nd,Sri Lanka,St George's Park,c D S Weerakkody b P A D L R Sandakan,34,40,85,,2884,43.7,94.43
71,71,01/02/2017,1st,Sri Lanka,Kingsmead,c R A S Lakmal b D de Silva,17,22,77.27,,2901,43.3,94.31
72,72,04/02/2017,2nd,Sri Lanka,Wanderers Stadium,b L Kumara,8,11,72.73,,2909,42.78,94.23
73,73,07/02/2017,1st,Sri Lanka,Newlands,c W U Tharanga b S S Pathirana,55,46,119.57,,2964,42.96,94.61
74,74,10/02/2017,1st,Sri Lanka,SuperSport Park,c D S Weerakkody b R A S Lakmal,109,87,125.29,,3073,43.9,95.43
75,75,19/02/2017,2nd,New Zealand,Seddon Park,c L R P L Taylor b T A Boult,69,64,107.81,,3142,44.25,95.68
76,76,22/02/2017,2nd,New Zealand,Hagley Oval,c J D S Neesham b T A Boult,57,65,87.69,,3199,44.43,95.52
77,77,25/02/2017,1st,New Zealand,Sky Stadium,c J D S Neesham b C de Grandhomme,68,70,97.14,,3267,44.75,95.55
78,78,01/03/2017,1st,New Zealand,Seddon Park,c †L Ronchi b J S Patel,0,1,0,,3267,44.15,95.53
79,79,04/03/2017,2nd,New Zealand,Eden Park,c K S Williamson b J S Patel,6,10,60,,3273,43.64,95.42
80,80,24/05/2017,2nd,England,Headingley,c †J C Buttler b C R Woakes,5,13,38.46,,3278,43.13,95.21
81,81,27/05/2017,2nd,England,The Rose Bowl,c †J C Buttler b M M Ali,98,103,95.15,,3376,43.84,95.21
82,82,29/05/2017,2nd,England,Lord's,b J T Ball,34,39,87.18,,3410,43.72,95.12
83,83,03/06/2017,1st,Sri Lanka,Kennington Oval,c †N Dickwella b N Pradeep,23,42,54.76,,3433,43.46,94.65
84,84,07/06/2017,1st,Pakistan,Edgbaston,lbw b Mohammad Hafeez,33,49,67.35,,3466,43.33,94.29
85,85,11/06/2017,1st,India,Kennington Oval,b R A Jadeja,53,72,73.61,,3519,43.44,93.89
86,86,15/10/2017,2nd,Bangladesh,Diamond Oval,not out,168*,145,115.86,,3687,45.52,94.71
87,87,18/10/2017,1st,Bangladesh,Boland Park,lbw b Shakib Al Hasan,46,61,75.41,,3733,45.52,94.41
88,88,22/10/2017,1st,Bangladesh,Buffalo Park,c & b Mehidy Hasan Miraz,73,68,107.35,,3806,45.86,94.63
89,89,01/02/2018,1st,India,Kingsmead,lbw b Y S Chahal,34,49,69.39,,3840,45.71,94.33
90,90,04/02/2018,1st,India,SuperSport Park,c H H Pandya b Y S Chahal,20,36,55.56,,3860,45.41,93.99
91,91,29/07/2018,2nd,Sri Lanka,Rangiri Dambulla International Stadium,c R A S Lakmal b M K P A Dananjaya,47,59,79.66,,3907,45.43,93.78
92,92,01/08/2018,2nd,Sri Lanka,Rangiri Dambulla International Stadium,c R A S Lakmal b K Rajitha,87,78,111.54,,3994,45.91,94.11
93,93,05/08/2018,1st,Sri Lanka,Pallekele International Cricket Stadium,c M D K J Perera b L Kumara,2,8,25,,3996,45.41,93.98
94,94,08/08/2018,2nd,Sri Lanka,Pallekele International Cricket Stadium,b R A S Lakmal,23,13,176.92,,4019,45.16,94.23
95,95,12/08/2018,2nd,Sri Lanka,R Premadasa Stadium,b M K P A Dananjaya,54,57,94.74,,4073,45.26,94.24
96,96,04/11/2018,2nd,Australia,Perth Stadium,c J R Hazlewood b N M Coulter-Nile,47,40,117.5,,4120,45.27,94.45
97,97,09/11/2018,2nd,Australia,Adelaide Oval,c A Zampa b M A Starc,9,12,75,,4129,44.88,94.4
98,98,11/11/2018,1st,Australia,Bellerive Oval,c †A T Carey b M A Starc,4,7,57.14,,4133,44.44,94.34
99,99,25/01/2019,2nd,Pakistan,SuperSport Park,run out,33,36,91.67,,4166,44.32,94.32
100,100,27/01/2019,1st,Pakistan,Wanderers Stadium,lbw b Shaheen Shah Afridi,0,7,0,,4166,43.85,94.17
101,101,30/01/2019,2nd,Pakistan,Newlands,c sub b Usman Shinwari,83,58,143.1,,4249,44.26,94.8
102,102,03/03/2019,2nd,Sri Lanka,Wanderers Stadium,lbw b M K P A Dananjaya,81,72,112.5,,4330,44.64,95.08
103,103,06/03/2019,1st,Sri Lanka,SuperSport Park,c †N Dickwella b N L T C Perera,94,70,134.29,,4424,45.14,95.67
104,104,10/03/2019,1st,Sri Lanka,Kingsmead,c †N Dickwella b K Rajitha,121,108,112.04,,4545,45.91,96.05
105,105,13/03/2019,2nd,Sri Lanka,St George's Park,c W U Tharanga b D de Silva,51,57,89.47,,4596,45.96,95.97
106,106,16/03/2019,2nd,Sri Lanka,Newlands,c W I A Fernando b S L Malinga,6,14,42.86,,4602,45.56,95.82
107,107,30/05/2019,2nd,England,Kennington Oval,c J E Root b L E Plunkett,68,74,91.89,,4670,45.78,95.76
108,108,02/06/2019,2nd,Bangladesh,Kennington Oval,run out,23,32,71.88,,4693,45.56,95.6
109,109,05/06/2019,1st,India,The Rose Bowl,c V Kohli b J J Bumrah,10,17,58.82,,4703,45.22,95.47
110,110,10/06/2019,1st,West Indies,The Rose Bowl,not out,17*,21,80.95,,4720,45.38,95.41
111,111,15/06/2019,2nd,Afghanistan,Sophia Gardens,c Mohammad Nabi b Gulbadin Naib,68,72,94.44,,4788,45.6,95.4
112,112,19/06/2019,1st,New Zealand,Edgbaston,b T A Boult,5,8,62.5,,4793,45.22,95.35
113,113,23/06/2019,2nd,Pakistan,Lord's,c Imam-ul-Haq b Shadab Khan,47,60,78.33,,4840,45.23,95.14
114,114,28/06/2019,2nd,Sri Lanka,Riverside Ground,b S L Malinga,15,16,93.75,,4855,44.95,95.14
115,115,06/07/2019,1st,Australia,Old Trafford,c M A Starc b N M Lyon,52,51,101.96,,4907,45.02,95.21
116,116,04/02/2020,2nd,England,Newlands,b J E Root,107,113,94.69,,5014,45.58,95.2
117,117,07/02/2020,1st,England,Kingsmead,b J E Root,11,17,64.71,,5025,45.27,95.1
118,118,09/02/2020,1st,England,Wanderers Stadium,b A U Rashid,69,81,85.19,,5094,45.48,94.95
119,119,29/02/2020,1st,Australia,Boland Park,c †A T Carey b J R Hazlewood,15,16,93.75,,5109,45.21,94.95
120,120,04/03/2020,2nd,Australia,Mangaung Oval,b M A Starc,0,2,0,,5109,44.82,94.91
121,121,07/03/2020,2nd,Australia,Senwes Park,b J R Hazlewood,26,31,83.87,,5135,44.65,94.85
122,122,02/04/2021,1st,Pakistan,SuperSport Park,c Babar Azam b Shaheen Shah Afridi,20,18,111.11,,5155,44.44,94.9
123,123,04/04/2021,1st,Pakistan,Wanderers Stadium,b Haris Rauf,80,86,93.02,,5235,44.74,94.87
124,124,16/07/2021,1st,Ireland,The Village,c M R Adair b Simi Singh,120,91,131.87,,5355,45.38,95.47
125,125,19/01/2022,1st,India,Boland Park,b R Ashwin,27,41,65.85,,5382,45.23,95.26
126,126,21/01/2022,2nd,India,Boland Park,lbw b S N Thakur,78,66,118.18,,5460,45.5,95.52
127,127,23/01/2022,1st,India,Newlands,c S Dhawan b J J Bumrah,124,130,95.38,,5584,46.15,95.52
128,128,20/03/2022,2nd,Bangladesh,Wanderers Stadium,c Afif Hossain b Shakib Al Hasan,62,41,151.22,,5646,46.28,95.91
129,129,23/03/2022,1st,Bangladesh,SuperSport Park,c Mahmudullah b Mehidy Hasan Miraz,12,8,150,,5658,46,95.98
130,130,19/07/2022,1st,England,Riverside Ground,b S M Curran,19,22,86.36,,5677,45.78,95.94
131,131,22/07/2022,2nd,England,Old Trafford,c L S Livingstone b D J Willey,5,9,55.56,,5682,45.46,95.88
132,132,24/07/2022,1st,England,Headingley,not out,92*,76,121.05,,5774,46.19,96.2
133,133,06/10/2022,1st,India,Bharat Ratna Shri Atal Bihari Vajpayee Ekana Cricket Stadium,lbw b R Ravi Bishnoi,48,54,88.89,,5822,46.21,96.14
134,134,09/10/2022,1st,India,JSCA International Stadium Complex,b Mohammed Siraj,5,8,62.5,,5827,45.88,96.09
135,135,11/10/2022,1st,India,Arun Jaitley Stadium,c Avesh Khan b Washington Sundar,6,10,60,,5833,45.57,96.03
136,136,27/01/2023,1st,England,Mangaung Oval,c †J C Buttler b S M Curran,37,41,90.24,,5870,45.5,95.99
137,137,29/01/2023,2nd,England,Mangaung Oval,c B M Duckett b O P Stone,31,28,110.71,,5901,45.39,96.06
138,138,18/03/2023,2nd,West Indies,Buffalo Park,lbw b K R Mayers,48,26,184.62,,5949,45.41,96.43
139,139,31/03/2023,2nd,Netherlands,Willowmoore Park,c F J Klaassen b Aryan Dutt,9,21,42.86,,5958,45.14,96.25
140,140,02/04/2023,1st,Netherlands,Wanderers Stadium,c T L W Cooper b V J Kingma,8,19,42.11,,5966,44.86,96.09
141,141,07/09/2023,1st,Australia,Mangaung Oval,c C Green b M P Stoinis,11,31,35.48,,5977,44.6,95.79
142,142,09/09/2023,2nd,Australia,Mangaung Oval,c & b N Ellis,45,30,150,,6022,44.61,96.04
143,143,12/09/2023,1st,Australia,Senwes Park,c D A Warner b T M Head,82,77,106.49,,6104,44.88,96.17
144,144,15/09/2023,1st,Australia,SuperSport Park,c M R Marsh b J R Hazlewood,45,64,70.31,,6149,44.88,95.91
145,145,17/09/2023,1st,Australia,Wanderers Stadium,c C Green b N Ellis,27,39,69.23,,6176,44.75,95.75
146,146,07/10/2023,1st,Sri Lanka,Arun Jaitley Stadium,c D de Silva b M Pathirana,100,84,119.05,,6276,45.15,96.05
147,147,12/10/2023,1st,Australia,Bharat Ratna Shri Atal Bihari Vajpayee Ekana Cricket Stadium,b G J Maxwell,109,106,102.83,,6385,45.61,96.16
148,148,17/10/2023,2nd,Netherlands,Himachal Pradesh Cricket Association Stadium,c †S A Edwards b C N Ackermann,20,22,90.91,,6405,45.43,96.14
149,149,21/10/2023,1st,England,Wankhede Stadium,c †J C Buttler b R J W Topley,4,2,200,,6409,45.13,96.17
150,150,24/10/2023,1st,Bangladesh,Wankhede Stadium,c Nasum Ahmed b Hasan Mahmud,174,140,124.29,,6583,46.03,96.75
151,151,27/10/2023,2nd,Pakistan,MA Chidambaram Stadium,c Mohammad Wasim b Shaheen Shah Afridi,24,14,171.43,,6607,45.88,96.91
152,152,01/11/2023,1st,New Zealand,Maharashtra Cricket Association Stadium,c G D Phillips b T G Southee,114,116,98.28,,6721,46.35,96.93
153,153,05/11/2023,2nd,India,Eden Gardens,b Mohammed Siraj,5,10,50,,6726,46.07,96.86
154,154,10/11/2023,2nd,Afghanistan,Narendra Modi Stadium,lbw b Mohammad Nabi,41,47,87.23,,6767,46.03,96.8
No. of Innings Played = 154,,,,,,,,,,,,,